{"여행지 이름":"일본 오사카 — 난바를 거점으로 한 맛집 중심 3박 4일","일자별 일정":[{"날짜":"2026-09-10","장소":"난바·센니치마에·도톤보리","활동내용":"날짜를 지정하지 않아 2026-09-10 출발로 구성한 예시 일정입니다. 오후 체크인 → 15:30 [와나카 센니치마에 본점](https://takoyaki-wanaka.com/index.html)에서 타코야키 오오이리 4종을 간식으로 맛보기 → 호젠지요코초와 [도톤보리](https://osaka-info.jp/en/spot/dotonbori/) 산책 → 18:30 [아지노야 본점](https://ajinoya-okonomiyaki.com/top/company/main-shop/)에서 믹스 오코노미야키와 야키소바 저녁. 아지노야는 대기가 길어 공식 패스트패스를 미리 구매하는 편이 좋습니다."},{"날짜":"2026-09-11","장소":"후쿠시마·우메다·텐마","활동내용":"아침은 과일이나 요구르트로 가볍게 → 10:15 후쿠시마역 도착 후 줄 서서 11:00 [모에요멘스케](https://ramendb.supleks.jp/s/91035.html)의 기슈 오리 간장라멘 점심 → 나카노시마·우메다 산책과 카페 휴식 → 16:30 텐진바시스지 상점가 이동 → 17:00 [하루코마 본점](https://tabelog.com/osaka/A2701/A270103/27002205/)에서 참치·방어·장어·성게 등 대중초밥 저녁. 예약 불가이고 재료 소진 시 종료될 수 있어 이른 방문을 권합니다."},{"날짜":"2026-09-12","장소":"신세카이·덴노지·쓰루하시","활동내용":"10:30 신세카이 도착 → 11:00 [야에카츠](https://tabelog.com/en/osaka/A2701/A270206/27000443/)에서 소고기·새우·아스파라거스 쿠시카츠와 도테야키 점심 → 쓰텐카쿠 주변 및 덴노지 공원 산책 → 오후 아베노 하루카스 또는 카페에서 휴식 → 17:30 쓰루하시 이동 → 18:00 [야키니쿠 호르몬 소라](https://www.yakinikusora.jp/)에서 하라미·우설·호르몬 모둠 저녁. 소라는 공식 사이트에서 예약하고, 매장 이용시간 90분을 고려합니다."},{"날짜":"2026-09-13","장소":"구로몬시장·난바·간사이공항","활동내용":"09:30 [구로몬시장](https://osaka-info.jp/en/spot/kuromon-market/)에서 참치회·가리비구이·다시마키를 조금씩 나눠 먹기 → 11:30 [지유켄 난바 본점](https://www.jiyuken.co.jp/shop/sennichimae.html)에서 날달걀을 섞어 먹는 명물 카레로 마무리 → 난바에서 551 호라이 또는 리쿠로 오지상 치즈케이크 포장 → 호텔에서 짐을 찾아 난카이 전철로 간사이공항 이동. 오전 비행이라면 시장과 카레 일정은 1일 차에 분산합니다."}],"추천 숙소":["실속형: [소테츠 그랜드 프레사 오사카 난바](https://sotetsu-hotels.com/grand-fresa/namba/) — 닛폰바시역과 구로몬시장 접근성이 좋음","중급형: [히요리 호텔 오사카 난바 스테이션](https://namba.hiyori-hotel.jp/lang_en/) — 난카이 난바역과 가까워 공항 이동이 편리함","상급형: [호텔 로열 클래식 오사카](https://hotel-royalclassic.jp/en/access) — 오사카 메트로 난바역과 직접 연결"],"예상 총경비":1050000,"준비물 목록":["여권과 여행자보험","ICOCA 또는 교통 결제가 가능한 카드","현금 2만~3만 엔과 해외결제 카드","식당 예약 내역: 아지노야 패스트패스, 야키니쿠 소라","Google Maps와 일본어 번역 앱","보조배터리와 동전지갑","편한 운동화와 접이식 우산","예산 기준: 1인 항공 32만 원, 숙박 39만 원, 식비 20만 원, 교통 6만 원, 관광·예비비 8만 원을 합산한 금액이며 쇼핑은 제외","실제 여행 날짜·인원·출발 공항이 정해지면 식당 휴무일과 항공료를 다시 확인"]}